finding_id,severity,cvss,title,affected_host,affected_port,category,priority,recommended_action,status
VA-001,Critical,10.0,Canonical Ubuntu Linux SEoL 8.04.x,192.168.56.101,80/tcp,Unsupported operating system,P1,Upgrade to a currently supported operating system,Open
VA-002,Critical,10.0,VNC Server password Password,192.168.56.101,5900/tcp,Weak authentication,P1,Set a strong VNC password or disable VNC if not required,Open
VA-003,Critical,9.8,SSL Version 2 and 3 Protocol Detection,192.168.56.101,Multiple,Weak encryption protocol,P1,Disable SSLv2 and SSLv3 and enable modern TLS only,Open
VA-004,Critical,9.8,Bind Shell Backdoor Detection,192.168.56.101,1524/tcp,Backdoor exposure,P1,Investigate compromise and rebuild or reinstall affected system,Open
VA-005,High,7.5,rlogin Service Detection,192.168.56.101,513/tcp,Insecure remote access,P2,Disable rlogin and use SSH instead,Open
VA-006,High,7.5,Samba Badlock Vulnerability,192.168.56.101,445/tcp,SMB vulnerability,P2,Upgrade Samba to a patched version,Open
VA-007,High,7.5,NFS Shares World Readable,192.168.56.101,NFS,Insecure file sharing,P2,Restrict NFS share permissions to authorized hosts only,Open
VA-008,Medium,6.5,TLS Version 1.0 Protocol Detection,192.168.56.101,Multiple,Weak encryption protocol,P3,Disable TLS 1.0 and use TLS 1.2 or later,Open
VA-009,Medium,6.5,Unencrypted Telnet Server,192.168.56.101,23/tcp,Cleartext remote access,P3,Disable Telnet and use SSH instead,Open
VA-010,Medium,5.9,SSL DROWN Attack Vulnerability,192.168.56.101,Multiple,SSL vulnerability,P3,Disable SSLv2 and update affected SSL services,Open
